{
  "module": "github.com/example/google-workspace",
  "name": "google-workspace",
  "runtime": "typescript-sandbox",
  "sha256": "05c4b9114f91259dea50ac050663ccf435eaa7b7417eb9ad1fcb58dac694662b",
  "allowed_hosts": [
    "admin.googleapis.com"
  ],
  "credentials": [
    {
      "name": "workspace",
      "type": "oauth2",
      "provider": "google",
      "scopes": [
        "openid",
        "email",
        "https://www.googleapis.com/auth/admin.directory.user.readonly"
      ],
      "inject": {
        "hosts": [
          "admin.googleapis.com"
        ],
        "method": "bearer_header"
      }
    }
  ],
  "tools": [
    {
      "entry_ts": "tools/users.list.ts",
      "idempotent": true,
      "effect": "readOnly"
    }
  ]
}
