{
  "module": "fixtures.local/fetch-test",
  "name": "fetch-test",
  "runtime": "typescript-sandbox",
  "tools": [
    {
      "entry_ts": "tools/fetch-test.get.ts",
      "idempotent": true,
      "effect": "readOnly"
    },
    {
      "entry_ts": "tools/fetch-test.with-headers.ts",
      "idempotent": true,
      "effect": "readOnly"
    }
  ]
}
