{
  "name": "github-issues",
  "runtime": "typescript-sandbox",
  "sha256": "e677577d710ae2a833f11a67d263c25bd45037f4c5a1f4b0edf7f0a27fb91295",
  "additionalTypeScriptGlobs": [
    "tools/shims.ts"
  ],
  "tools": [
    {
      "entry_ts": "tools/github-issues.get.ts",
      "idempotent": true,
      "effect": "readOnly"
    }
  ]
}
