{
  "module": "fixtures.local/edge-cases",
  "name": "edge-cases",
  "runtime": "typescript-sandbox",
  "sha256": "f0ff3f2a7651807f6ffbaa4d1a6350669fe38d5f05c939ead09d4580f8ce2954",
  "tools": [
    {
      "entry_ts": "tools/edge-cases.complex.ts",
      "idempotent": true,
      "effect": "readOnly"
    },
    {
      "entry_ts": "tools/edge-cases.params-object.ts",
      "idempotent": true,
      "effect": "irreversible"
    },
    {
      "entry_ts": "tools/edge-cases.minimal.ts",
      "idempotent": true,
      "effect": "readOnly"
    },
    {
      "entry_ts": "tools/edge-cases.no-description.ts",
      "idempotent": true,
      "effect": "readOnly"
    },
    {
      "entry_ts": "tools/edge-cases.multiline-param.ts",
      "idempotent": true,
      "effect": "readOnly"
    },
    {
      "entry_ts": "tools/edge-cases.irreversible.ts",
      "effect": "irreversible",
      "description": "Permanently delete all records matching the filter."
    },
    {
      "entry_ts": "tools/edge-cases.reversible.ts",
      "idempotent": true,
      "effect": "reversible"
    },
    {
      "entry_ts": "tools/edge-cases.named-export.ts",
      "idempotent": true,
      "effect": "readOnly"
    },
    {
      "entry_ts": "tools/edge-cases.async-complex.ts",
      "effect": "irreversible"
    },
    {
      "entry_ts": "tools/edge-cases.no-params.ts",
      "idempotent": true,
      "effect": "readOnly"
    },
    {
      "entry_ts": "tools/edge-cases.multiline-return.ts",
      "effect": "readOnly"
    }
  ]
}
